{
  "schemaVersion": 1,
  "userId": "family_1",
  "instance": { "id": "i-example", "state": "running", "hibernationConfigured": true },
  "volume": { "id": "vol-example", "attached": true, "encrypted": true },
  "image": { "id": "ami-example", "release": "salvo-0.1.0", "verified": true },
  "service": { "ready": true, "tunnelConnected": true, "checkedAt": "2026-08-24T12:00:00Z" }
}
